{
  "daily_events": [
    {
      "duration_minutes": 120,
      "id": "event_01_artist",
      "label": "Studio practice",
      "location_id": "structure_quiet_studio",
      "module_refs": [
        "labor_time.life_burden_ledger.v0_1"
      ],
      "resident_id": "resident_artist_01",
      "time": "10:00",
      "type": "passion_time",
      "visual": {
        "animation_hint": "walk_work_idle",
        "icon": "studio"
      }
    },
    {
      "duration_minutes": 60,
      "id": "event_02_elder",
      "label": "Low-pressure common meal",
      "location_id": "structure_common_house",
      "module_refs": [
        "social_cultural_commons.belonging_without_coercion.v0_1"
      ],
      "resident_id": "resident_elder_02",
      "time": "11:30",
      "type": "social",
      "visual": {
        "animation_hint": "walk_work_idle",
        "icon": "meal"
      }
    },
    {
      "duration_minutes": 90,
      "id": "event_03_caregiver",
      "label": "Care continuity check",
      "location_id": "structure_care_room",
      "module_refs": [
        "risk_resilience.graceful_degradation_engine.v0_1"
      ],
      "resident_id": "resident_caregiver_03",
      "time": "08:30",
      "type": "care",
      "visual": {
        "animation_hint": "walk_work_idle",
        "icon": "care"
      }
    },
    {
      "duration_minutes": 90,
      "id": "event_04_student",
      "label": "Skill lattice practice",
      "location_id": "structure_maintenance_shop",
      "module_refs": [
        "education_skill.civic_skill_lattice.v0_1"
      ],
      "resident_id": "resident_student_04",
      "time": "14:00",
      "type": "learning",
      "visual": {
        "animation_hint": "walk_work_idle",
        "icon": "learn"
      }
    },
    {
      "duration_minutes": 75,
      "id": "event_05_maintenance_steward",
      "label": "Asset registry round",
      "location_id": "structure_maintenance_shop",
      "module_refs": [
        "maintenance.maintainable_commons_spine.v0_1"
      ],
      "resident_id": "resident_maintenance_steward_05",
      "time": "09:00",
      "type": "maintenance",
      "visual": {
        "animation_hint": "walk_work_idle",
        "icon": "tool"
      }
    },
    {
      "duration_minutes": 90,
      "id": "event_06_food_steward",
      "label": "Garden commons shift",
      "location_id": "structure_food_commons",
      "module_refs": [
        "food.hybrid_food_commons.v0_1"
      ],
      "resident_id": "resident_food_steward_06",
      "time": "09:30",
      "type": "commons_labor",
      "visual": {
        "animation_hint": "walk_work_idle",
        "icon": "garden"
      }
    },
    {
      "duration_minutes": 120,
      "id": "event_07_researcher",
      "label": "Evidence review",
      "location_id": "structure_quiet_studio",
      "module_refs": [
        "risk_resilience.graceful_degradation_engine.v0_1"
      ],
      "resident_id": "resident_researcher_07",
      "time": "15:00",
      "type": "passion_time",
      "visual": {
        "animation_hint": "walk_work_idle",
        "icon": "research"
      }
    },
    {
      "duration_minutes": 45,
      "id": "event_08_child",
      "label": "Protected play/rest",
      "location_id": "structure_social_cultural",
      "module_refs": [
        "social_cultural_commons.belonging_without_coercion.v0_1"
      ],
      "resident_id": "resident_child_08",
      "time": "16:00",
      "type": "rest",
      "visual": {
        "animation_hint": "walk_work_idle",
        "icon": "play"
      }
    },
    {
      "duration_minutes": 45,
      "id": "event_09_governance_steward",
      "label": "Decision log review",
      "location_id": "structure_common_house",
      "module_refs": [
        "governance.commons_stewardship_protocol.v0_1"
      ],
      "resident_id": "resident_governance_steward_09",
      "time": "17:30",
      "type": "governance",
      "visual": {
        "animation_hint": "walk_work_idle",
        "icon": "governance"
      }
    },
    {
      "duration_minutes": 45,
      "id": "event_10_water_energy_steward",
      "label": "Water and energy check",
      "location_id": "node_solar_battery",
      "module_refs": [
        "water.resilient_water_commons.v0_1",
        "energy.critical_load_energy_commons.v0_1"
      ],
      "resident_id": "resident_water_energy_steward_11",
      "time": "07:45",
      "type": "maintenance",
      "visual": {
        "animation_hint": "walk_work_idle",
        "icon": "energy"
      }
    },
    {
      "duration_minutes": 120,
      "id": "event_11_resting_resident",
      "label": "Quiet recovery block",
      "location_id": "structure_quiet_studio",
      "module_refs": [
        "labor_time.life_burden_ledger.v0_1"
      ],
      "resident_id": "resident_resting_resident_12",
      "time": "13:00",
      "type": "rest",
      "visual": {
        "animation_hint": "walk_work_idle",
        "icon": "rest"
      }
    },
    {
      "duration_minutes": 60,
      "id": "event_12_visitor",
      "label": "Hosted introduction",
      "location_id": "structure_common_house",
      "module_refs": [
        "social_cultural_commons.belonging_without_coercion.v0_1"
      ],
      "resident_id": "resident_visitor_10",
      "time": "12:30",
      "type": "social",
      "visual": {
        "animation_hint": "walk_work_idle",
        "icon": "visit"
      }
    }
  ],
  "evidence_cards": [
    {
      "assumptions": [
        "Aggregate care state is modeled through modules attached to this room."
      ],
      "id": "evidence_care_room",
      "module_refs": [
        "risk_resilience.graceful_degradation_engine.v0_1",
        "care_health.care_health_high_need_meal_illness_support_v0.active",
        "care_health.care_health_resident_controlled_medication_continuity_kit_v0.active"
      ],
      "review_required": [
        "health",
        "privacy",
        "accessibility"
      ],
      "source_ids": [
        "BLS_ATUS_2024",
        "CDC_CHW_CHRONIC_CARE",
        "CDC_CHW_PREVENTING_CHRONIC_DISEASE",
        "CDC_DISABILITY_EMERGENCY_KIT",
        "CDC_RESPIRATORY_PREVENTION",
        "CDC_WELL_TESTING",
        "COHOUSING_HEALTH_SCOPING",
        "EPA_SEPTIC",
        "EVANS_BUILT_ENVIRONMENT_MENTAL_HEALTH",
        "FDA_FOOD_CODE_2022",
        "FEMA_NATIONAL_RESILIENCE_GUIDANCE",
        "GREEN_HOUSE_MODEL",
        "GREEN_HOUSE_SMALL_HOUSE",
        "HRSA_HEALTH_CENTER_PROGRAM",
        "IMPACT_CHW_RCT",
        "OECD_WORK_LIFE_BALANCE",
        "ROLLINGS_EVANS_CROWDING_DESIGN",
        "SURGEON_GENERAL_SOCIAL_CONNECTION",
        "UKRI_FOUR_DAY_WEEK",
        "WHO_EMERGENCY_WATER_20L",
        "WHO_HOUSING_2018",
        "WHO_HOUSING_CROWDING_NCBI",
        "WHO_ILO_LONG_WORKING_HOURS",
        "WHO_SANITATION_SAFETY_PLANNING"
      ],
      "source_note": "Sources support modeled capability gates and review assumptions; they are not approvals to build or operate.",
      "sources": [
        {
          "evidence_quality": "high",
          "id": "BLS_ATUS_2024",
          "organization": "Bureau of Labor Statistics",
          "supports": [
            "care_activities",
            "care_labor",
            "gender_distribution_of_household_labor",
            "household_activities",
            "household_labor",
            "leisure_time",
            "paid_work",
            "work_time"
          ],
          "title": "American Time Use Survey, 2024 Results",
          "url": "https://www.bls.gov/news.release/atus.nr0.htm"
        },
        {
          "evidence_quality": "mixed",
          "id": "CDC_CHW_CHRONIC_CARE",
          "organization": "CDC",
          "supports": [
            "community_health_worker_support",
            "nonclinical_care_navigation"
          ],
          "title": "Emerging Model for Community Health Worker-Based Chronic Care Management",
          "url": "https://www.cdc.gov/pcd/issues/2020/19_0316.htm"
        },
        {
          "evidence_quality": "mixed",
          "id": "CDC_CHW_PREVENTING_CHRONIC_DISEASE",
          "organization": "CDC / Preventing Chronic Disease",
          "supports": [
            "community_health_workers_can_provide_behavioral_support_and_care_navigation"
          ],
          "title": "Emerging Model for Community Health Worker-Based Chronic Care Management",
          "url": "https://www.cdc.gov/pcd/issues/2020/19_0316.htm"
        },
        {
          "evidence_quality": "high",
          "id": "CDC_DISABILITY_EMERGENCY_KIT",
          "organization": "CDC",
          "supports": [
            "assistive_device_power",
            "batteries_and_chargers_for_assistive_devices",
            "batteries_chargers_assistive_devices",
            "cooler_for_refrigerated_medications",
            "emergency_health_documents",
            "high_need_support",
            "medication_continuity",
            "mobility_devices_and_health_documents",
            "one_week_prescription_medication_supply",
            "refrigerated_medication_backup"
          ],
          "title": "Building an Emergency Kit for People with Disabilities",
          "url": "https://www.cdc.gov/disability-emergency-preparedness/people-with-disabilities/build-a-kit.html"
        },
        {
          "evidence_quality": "high",
          "id": "CDC_RESPIRATORY_PREVENTION",
          "organization": "CDC",
          "supports": [
            "cleaner_air",
            "hygiene",
            "illness_wave_protocol",
            "masks_as_layered_protection",
            "stay_home_when_sick"
          ],
          "title": "Preventing Respiratory Illnesses",
          "url": "https://www.cdc.gov/respiratory-viruses/prevention/index.html"
        },
        {
          "evidence_quality": "mixed",
          "id": "CDC_WELL_TESTING",
          "organization": "U.S. Centers for Disease Control and Prevention",
          "supports": [
            "annual_well_testing_total_coliform_nitrates_TDS_pH",